{
  "schema_version": "1.0.0",
  "content_version": "0.2.2",
  "gap_set_id": "cgs_cn_moe_senior_high_math_2020_outcomes",
  "framework_id": "cfw_cn_moe_senior_high_math_2020_outcomes",
  "curriculum_id": "cur_cn_moe_senior_high_math_2020",
  "subject": "Mathematics",
  "source_ids": [
    "src_cn_moe_senior_high_math_2025"
  ],
  "generated_at": "2026-07-19",
  "review_status": "approved",
  "changelog": [
    {
      "version": "0.1.0",
      "date": "2026-07-19",
      "summary_zh": "把逐成果未覆盖项分类为新增概念、拆分或收窄既有概念、以及不应进入知识概念的实践要求。"
    },
    {
      "version": "0.2.0",
      "date": "2026-07-19",
      "summary_zh": "第二轮逐项人工式复核后同步 101 个缺口候选，并保持所有候选待人工批准。"
    },
    {
      "version": "0.2.1",
      "date": "2026-10-25",
      "summary_zh": "按 2026-10-25 官方来源复核更新证据定位（中国课标迁至 2025 日常修订版、新加坡页码校正），状态保持 needs_review。"
    },
    {
      "version": "0.2.2",
      "date": "2026-10-25",
      "summary_zh": "完成联网复核与人工批准。"
    }
  ],
  "candidates": [
    {
      "gap_id": "gap_cn_sh_math_2020_o_set_membership_representation",
      "requirement_ids": [
        "req_cn_sh_math_2020_o_set_membership_representation"
      ],
      "action": "add_concept",
      "proposed_name": "Set membership and representation",
      "proposed_name_zh": "集合、元素与表示",
      "scope_zh": "理解集合、元素与属于关系，并能用自然语言、图形和符号表示集合。",
      "existing_canonical_ids": [],
      "suggested_graph_id": "senior_secondary_mathematics",
      "rationale_zh": "当前统一 KG 没有可独立出题诊断的对应概念，建议作为新增概念候选。",
      "evidence_refs": [
        {
          "source_id": "src_cn_moe_senior_high_math_2025",
          "locator": "数学课程标准PDF p.17-18（正文p.14-15），必修主题一·1‘集合’"
        }
      ],
      "review_status": "approved"
    },
    {
      "gap_id": "gap_cn_sh_math_2020_o_set_relations_special_sets",
      "requirement_ids": [
        "req_cn_sh_math_2020_o_set_relations_special_sets"
      ],
      "action": "add_concept",
      "proposed_name": "Set relations and special sets",
      "proposed_name_zh": "集合关系、全集与空集",
      "scope_zh": "理解全集、空集、子集、包含和集合相等，并能识别给定集合的关系。",
      "existing_canonical_ids": [],
      "suggested_graph_id": "senior_secondary_mathematics",
      "rationale_zh": "当前统一 KG 没有可独立出题诊断的对应概念，建议作为新增概念候选。",
      "evidence_refs": [
        {
          "source_id": "src_cn_moe_senior_high_math_2025",
          "locator": "数学课程标准PDF p.17-18（正文p.14-15），必修主题一·1‘集合’"
        }
      ],
      "review_status": "approved"
    },
    {
      "gap_id": "gap_cn_sh_math_2020_o_set_operations",
      "requirement_ids": [
        "req_cn_sh_math_2020_o_set_operations"
      ],
      "action": "add_concept",
      "proposed_name": "Set operations",
      "proposed_name_zh": "集合基本运算",
      "scope_zh": "理解并集、交集和补集并能完成基本集合运算。",
      "existing_canonical_ids": [],
      "suggested_graph_id": "senior_secondary_mathematics",
      "rationale_zh": "当前统一 KG 没有可独立出题诊断的对应概念，建议作为新增概念候选。",
      "evidence_refs": [
        {
          "source_id": "src_cn_moe_senior_high_math_2025",
          "locator": "数学课程标准PDF p.17-18（正文p.14-15），必修主题一·1‘集合’"
        }
      ],
      "review_status": "approved"
    },
    {
      "gap_id": "gap_cn_sh_math_2020_o_venn_diagrams",
      "requirement_ids": [
        "req_cn_sh_math_2020_o_venn_diagrams"
      ],
      "action": "add_concept",
      "proposed_name": "Venn diagrams",
      "proposed_name_zh": "Venn 图表达",
      "scope_zh": "使用 Venn 图表达集合关系和集合运算，并在图形与符号表达之间转换。",
      "existing_canonical_ids": [],
      "suggested_graph_id": "senior_secondary_mathematics",
      "rationale_zh": "当前统一 KG 没有可独立出题诊断的对应概念，建议作为新增概念候选。",
      "evidence_refs": [
        {
          "source_id": "src_cn_moe_senior_high_math_2025",
          "locator": "数学课程标准PDF p.17-18（正文p.14-15），必修主题一·1‘集合’"
        }
      ],
      "review_status": "approved"
    },
    {
      "gap_id": "gap_cn_sh_math_2020_o_logical_conditions",
      "requirement_ids": [
        "req_cn_sh_math_2020_o_logical_conditions"
      ],
      "action": "split_or_narrow_existing",
      "proposed_name": "Necessary and sufficient conditions",
      "proposed_name_zh": "必要、充分与充要条件",
      "scope_zh": "辨析必要条件、充分条件和充要条件，并联系性质定理、判定定理和数学定义。",
      "existing_canonical_ids": [
        "pc_d5bec4f6173c3415d0f2a5968a66c69d"
      ],
      "suggested_graph_id": "senior_secondary_mathematics",
      "rationale_zh": "现有概念范围过宽或缺少该课程边界；建议在不改旧 canonical ID 的前提下新增更窄概念并建立 alias/关系。",
      "evidence_refs": [
        {
          "source_id": "src_cn_moe_senior_high_math_2025",
          "locator": "数学课程标准PDF p.18-19（正文p.15-16），必修主题一·2‘常用逻辑用语’"
        }
      ],
      "review_status": "approved"
    },
    {
      "gap_id": "gap_cn_sh_math_2020_o_quantifiers_negation",
      "requirement_ids": [
        "req_cn_sh_math_2020_o_quantifiers_negation"
      ],
      "action": "add_concept",
      "proposed_name": "Quantifiers and negation",
      "proposed_name_zh": "量词命题及其否定",
      "scope_zh": "理解全称量词和存在量词，并能正确否定相应量词命题。",
      "existing_canonical_ids": [],
      "suggested_graph_id": "senior_secondary_mathematics",
      "rationale_zh": "当前统一 KG 没有可独立出题诊断的对应概念，建议作为新增概念候选。",
      "evidence_refs": [
        {
          "source_id": "src_cn_moe_senior_high_math_2025",
          "locator": "数学课程标准PDF p.18-19（正文p.15-16），必修主题一·2‘常用逻辑用语’"
        }
      ],
      "review_status": "approved"
    },
    {
      "gap_id": "gap_cn_sh_math_2020_o_inequality_properties",
      "requirement_ids": [
        "req_cn_sh_math_2020_o_inequality_properties"
      ],
      "action": "split_or_narrow_existing",
      "proposed_name": "Properties of inequalities",
      "proposed_name_zh": "不等式概念与性质",
      "scope_zh": "理解不等式并掌握不等式的基本性质，能在等式与不等式之间进行比较。",
      "existing_canonical_ids": [
        "pc_4307437065fb6fce9aa3b4c05e7ed82d"
      ],
      "suggested_graph_id": "senior_secondary_mathematics",
      "rationale_zh": "现有概念范围过宽或缺少该课程边界；建议在不改旧 canonical ID 的前提下新增更窄概念并建立 alias/关系。",
      "evidence_refs": [
        {
          "source_id": "src_cn_moe_senior_high_math_2025",
          "locator": "数学课程标准PDF p.19（正文p.16），必修主题一·3‘相等关系与不等关系’"
        }
      ],
      "review_status": "approved"
    },
    {
      "gap_id": "gap_cn_sh_math_2020_o_basic_inequality_optimization",
      "requirement_ids": [
        "req_cn_sh_math_2020_o_basic_inequality_optimization"
      ],
      "action": "split_or_narrow_existing",
      "proposed_name": "Basic inequality and optimisation",
      "proposed_name_zh": "基本不等式与最值",
      "scope_zh": "掌握基本不等式，并用它解决简单最大值或最小值问题。",
      "existing_canonical_ids": [
        "pc_4307437065fb6fce9aa3b4c05e7ed82d"
      ],
      "suggested_graph_id": "senior_secondary_mathematics",
      "rationale_zh": "现有概念范围过宽或缺少该课程边界；建议在不改旧 canonical ID 的前提下新增更窄概念并建立 alias/关系。",
      "evidence_refs": [
        {
          "source_id": "src_cn_moe_senior_high_math_2025",
          "locator": "数学课程标准PDF p.19（正文p.16），必修主题一·3‘相等关系与不等关系’"
        }
      ],
      "review_status": "approved"
    },
    {
      "gap_id": "gap_cn_sh_math_2020_o_quadratic_roots_graph",
      "requirement_ids": [
        "req_cn_sh_math_2020_o_quadratic_roots_graph"
      ],
      "action": "split_or_narrow_existing",
      "proposed_name": "Quadratic roots from graphs",
      "proposed_name_zh": "二次函数图像与方程实根",
      "scope_zh": "借助二次函数图像判断一元二次方程实根的存在性和个数，并联系函数零点。",
      "existing_canonical_ids": [
        "pc_133d40fa0e72c29c5eb6ec7a9852c80c",
        "pc_2d2287436b31a462805b82876a1bc513"
      ],
      "suggested_graph_id": "senior_secondary_mathematics",
      "rationale_zh": "现有概念范围过宽或缺少该课程边界；建议在不改旧 canonical ID 的前提下新增更窄概念并建立 alias/关系。",
      "evidence_refs": [
        {
          "source_id": "src_cn_moe_senior_high_math_2025",
          "locator": "数学课程标准PDF p.19-20（正文p.16-17），必修主题一·4‘从函数观点看一元二次方程和一元二次不等式’"
        }
      ],
      "review_status": "approved"
    },
    {
      "gap_id": "gap_cn_sh_math_2020_o_quadratic_inequalities",
      "requirement_ids": [
        "req_cn_sh_math_2020_o_quadratic_inequalities"
      ],
      "action": "split_or_narrow_existing",
      "proposed_name": "Quadratic inequalities",
      "proposed_name_zh": "一元二次不等式",
      "scope_zh": "从情境中抽象一元二次不等式，借助二次函数求解并用集合表示解集。",
      "existing_canonical_ids": [
        "pc_133d40fa0e72c29c5eb6ec7a9852c80c",
        "pc_4307437065fb6fce9aa3b4c05e7ed82d"
      ],
      "suggested_graph_id": "senior_secondary_mathematics",
      "rationale_zh": "现有概念范围过宽或缺少该课程边界；建议在不改旧 canonical ID 的前提下新增更窄概念并建立 alias/关系。",
      "evidence_refs": [
        {
          "source_id": "src_cn_moe_senior_high_math_2025",
          "locator": "数学课程标准PDF p.19-20（正文p.16-17），必修主题一·4‘从函数观点看一元二次方程和一元二次不等式’"
        }
      ],
      "review_status": "approved"
    },
    {
      "gap_id": "gap_cn_sh_math_2020_o_function_equation_inequality_link",
      "requirement_ids": [
        "req_cn_sh_math_2020_o_function_equation_inequality_link"
      ],
      "action": "split_or_narrow_existing",
      "proposed_name": "Functions, equations and inequalities",
      "proposed_name_zh": "函数、方程与不等式联系",
      "scope_zh": "使用图像和代数关系说明一元二次函数、方程和不等式之间的联系。",
      "existing_canonical_ids": [
        "pc_133d40fa0e72c29c5eb6ec7a9852c80c",
        "pc_2d2287436b31a462805b82876a1bc513",
        "pc_4307437065fb6fce9aa3b4c05e7ed82d"
      ],
      "suggested_graph_id": "senior_secondary_mathematics",
      "rationale_zh": "现有概念范围过宽或缺少该课程边界；建议在不改旧 canonical ID 的前提下新增更窄概念并建立 alias/关系。",
      "evidence_refs": [
        {
          "source_id": "src_cn_moe_senior_high_math_2025",
          "locator": "数学课程标准PDF p.19-20（正文p.16-17），必修主题一·4‘从函数观点看一元二次方程和一元二次不等式’"
        }
      ],
      "review_status": "approved"
    },
    {
      "gap_id": "gap_cn_sh_math_2020_o_function_definition_domain",
      "requirement_ids": [
        "req_cn_sh_math_2020_o_function_definition_domain"
      ],
      "action": "split_or_narrow_existing",
      "proposed_name": "Function definition and domain",
      "proposed_name_zh": "函数概念、要素与定义域",
      "scope_zh": "用集合和对应关系刻画函数，理解函数要素并求简单函数定义域。",
      "existing_canonical_ids": [